{
  "$schema": "https://json-schema.org/draft/2020-12/schema",
  "$id": "urn:ayni:song:1.0",
  "title": "Ayni SongData 1.0",
  "type": "object",
  "additionalProperties": true,
  "required": [
    "formatVersion",
    "title",
    "bpm",
    "part",
    "key",
    "defaultTimeSignature",
    "markers",
    "navigation",
    "measures"
  ],
  "properties": {
    "formatVersion": {
      "const": "1.0"
    },
    "title": {
      "type": "string",
      "minLength": 1,
      "maxLength": 200
    },
    "bpm": {
      "type": "number",
      "minimum": 30,
      "maximum": 240
    },
    "part": {
      "type": "object",
      "additionalProperties": true,
      "required": [
        "id",
        "name",
        "instrument"
      ],
      "properties": {
        "id": {
          "type": "string",
          "minLength": 1
        },
        "name": {
          "type": "string",
          "minLength": 1
        },
        "instrument": {
          "type": "string",
          "minLength": 1
        }
      }
    },
    "key": {
      "type": "string"
    },
    "defaultTimeSignature": {
      "type": "object",
      "additionalProperties": false,
      "required": [
        "numerator",
        "denominator"
      ],
      "properties": {
        "numerator": {
          "type": "integer",
          "minimum": 1,
          "maximum": 32
        },
        "denominator": {
          "type": "integer",
          "enum": [
            1,
            2,
            4,
            8,
            16,
            32
          ]
        }
      }
    },
    "markers": {
      "type": "array",
      "items": {
        "type": "object",
        "required": [
          "measure",
          "label"
        ],
        "properties": {
          "measure": {
            "type": "integer",
            "minimum": 1
          },
          "label": {
            "type": "string"
          }
        }
      }
    },
    "navigation": {
      "type": "array",
      "items": {
        "type": "object",
        "additionalProperties": true,
        "required": [
          "type"
        ],
        "allOf": [
          {
            "oneOf": [
              {
                "type": "object",
                "required": [
                  "type",
                  "measure"
                ],
                "properties": {
                  "type": {
                    "const": "segno"
                  }
                }
              },
              {
                "type": "object",
                "required": [
                  "type",
                  "measure"
                ],
                "properties": {
                  "type": {
                    "const": "coda"
                  }
                }
              },
              {
                "type": "object",
                "required": [
                  "type",
                  "measure"
                ],
                "properties": {
                  "type": {
                    "const": "toCoda"
                  }
                }
              },
              {
                "type": "object",
                "required": [
                  "type",
                  "measure"
                ],
                "properties": {
                  "type": {
                    "const": "dalSegno"
                  }
                }
              },
              {
                "type": "object",
                "required": [
                  "type",
                  "measure"
                ],
                "properties": {
                  "type": {
                    "const": "daCapo"
                  }
                }
              },
              {
                "type": "object",
                "required": [
                  "type",
                  "measure"
                ],
                "properties": {
                  "type": {
                    "const": "fine"
                  }
                }
              },
              {
                "type": "object",
                "required": [
                  "type",
                  "startMeasure",
                  "endMeasure"
                ],
                "properties": {
                  "type": {
                    "const": "repeat"
                  }
                }
              },
              {
                "type": "object",
                "required": [
                  "type",
                  "startMeasure",
                  "endMeasure",
                  "number"
                ],
                "properties": {
                  "type": {
                    "const": "ending"
                  }
                }
              }
            ]
          }
        ],
        "properties": {
          "type": {
            "enum": [
              "segno",
              "coda",
              "toCoda",
              "dalSegno",
              "daCapo",
              "fine",
              "repeat",
              "ending"
            ]
          },
          "measure": {
            "type": "integer",
            "minimum": 1
          },
          "startMeasure": {
            "type": "integer",
            "minimum": 1
          },
          "endMeasure": {
            "type": "integer",
            "minimum": 1
          },
          "number": {
            "type": "integer",
            "minimum": 1,
            "maximum": 16
          },
          "times": {
            "type": "integer",
            "minimum": 2,
            "maximum": 16
          },
          "id": {
            "type": "string"
          },
          "target": {
            "type": "string"
          },
          "mode": {
            "enum": [
              "alCoda",
              "alFine",
              "end"
            ]
          },
          "needsReview": {
            "type": "boolean"
          }
        }
      }
    },
    "measures": {
      "type": "array",
      "minItems": 1,
      "maxItems": 5000,
      "items": {
        "type": "object",
        "additionalProperties": true,
        "required": [
          "number",
          "timeSignature",
          "events",
          "needsReview"
        ],
        "properties": {
          "number": {
            "type": "integer",
            "minimum": 1
          },
          "timeSignature": {
            "anyOf": [
              {
                "type": "null"
              },
              {
                "type": "object",
                "additionalProperties": false,
                "required": [
                  "numerator",
                  "denominator"
                ],
                "properties": {
                  "numerator": {
                    "type": "integer",
                    "minimum": 1,
                    "maximum": 32
                  },
                  "denominator": {
                    "type": "integer",
                    "enum": [
                      1,
                      2,
                      4,
                      8,
                      16,
                      32
                    ]
                  }
                }
              }
            ]
          },
          "beats": {
            "type": "number",
            "exclusiveMinimum": 0
          },
          "section": {
            "anyOf": [
              {
                "type": "null"
              },
              {
                "type": "string"
              }
            ]
          },
          "needsReview": {
            "type": "boolean"
          },
          "events": {
            "type": "array",
            "maxItems": 10000,
            "items": {
              "oneOf": [
                {
                  "type": "object",
                  "additionalProperties": true,
                  "required": [
                    "type",
                    "pitch",
                    "duration",
                    "role",
                    "needsReview"
                  ],
                  "properties": {
                    "type": {
                      "const": "note"
                    },
                    "pitch": {
                      "type": "string",
                      "pattern": "^[A-G][#b]?(-1|[0-9])$"
                    },
                    "role": {
                      "enum": [
                        "front",
                        "back",
                        "both",
                        "unknown"
                      ]
                    },
                    "duration": {
                      "type": "number",
                      "exclusiveMinimum": 0
                    },
                    "needsReview": {
                      "type": "boolean"
                    }
                  }
                },
                {
                  "type": "object",
                  "additionalProperties": true,
                  "required": [
                    "type",
                    "duration",
                    "needsReview"
                  ],
                  "properties": {
                    "type": {
                      "const": "rest"
                    },
                    "duration": {
                      "type": "number",
                      "exclusiveMinimum": 0
                    },
                    "needsReview": {
                      "type": "boolean"
                    }
                  }
                }
              ]
            }
          }
        }
      }
    }
  }
}
